{
  "schema_version": "lean-native-hardware-profile-v1",
  "profile_id": "apple_silicon_m3_metal",
  "target": "apple_metal",
  "llvm_target_cpu": "apple-m3",
  "sm_arch": "metal_3_1",
  "hardware_metadata": {
    "host_os": "darwin",
    "host_arch": "arm64",
    "cpu_arch": "apple-m3",
    "cpu_model": "Apple M3 (P-core / E-core)",
    "gpu_model": "Apple M3 10-Core Metal 3 GPU (Dynamic Caching / Unified Memory)",
    "l1d_bytes": 131072,
    "l2_bytes": 16777216,
    "slc_bytes": 8388608,
    "unified_memory": true
  },
  "cache_trm_tier": {
    "slice_id": "m2_neon_fp16",
    "d_model": 32,
    "d_hidden": 64,
    "ngram_buckets": 8192,
    "table_d": 8,
    "default_h_cycles": 2,
    "default_l_cycles": 2,
    "max_footprint_bytes": 98304,
    "inference_path": "cpu_neon_fp16_accelerate",
    "batch_gpu_path": "apple_metal_simdgroup_fp16"
  },
  "add_sub_cost": 1,
  "bitwise_cost": 1,
  "shift_cost": 1,
  "cmp_cost": 1,
  "mul_cost": 5,
  "div_mod_cost": 36,
  "fma_cost": 2,
  "select_cost": 1,
  "clz256_cost": 2,
  "add_sub_checked256_cost": 3,
  "mul_checked256_cost": 5,
  "min_gpu_elements": 32768,
  "gpu_block_threads": 256,
  "matmul_tile_dim": 16,
  "calibration_receipt": {
    "measured_ns": {
      "add_ns": 0.7746,
      "mul_ns": 0.7709,
      "div_ns": 5.0123,
      "fma_ns": 0.5121,
      "select_ns": 1.0256
    },
    "payload_digest_blake2b256": "cc472bea78f46d061b95da949bf31d6a6779acc2b7fb8e0bcec3cd61fb3fa819",
    "calibrated_at_utc": "2026-10-20T06:38:47Z"
  }
}
