{
  "schema_version": "lean-native-hardware-profile-v1",
  "profile_id": "colab_tpu_v5e_epyc_7b13",
  "target": "x86_64",
  "llvm_target_cpu": "x86-64-v3",
  "sm_arch": "tpu_v5e",
  "hardware_metadata": {
    "host_os": "linux",
    "host_arch": "x86_64",
    "cpu_arch": "zen3-avx2",
    "cpu_model": "AMD EPYC 7B13",
    "gpu_model": "Google Cloud TPU v5e (ct5lp-hightpu / MLIR-XLA)",
    "l1d_bytes": 32768,
    "l2_bytes": 524288,
    "slc_bytes": 33554432,
    "unified_memory": false
  },
  "cache_trm_tier": {
    "slice_id": "cpu_l2_int8",
    "d_model": 32,
    "d_hidden": 64,
    "ngram_buckets": 8192,
    "table_d": 8,
    "default_h_cycles": 2,
    "default_l_cycles": 2,
    "max_footprint_bytes": 98304,
    "inference_path": "tpu_vmem_bf16",
    "batch_gpu_path": "tpu_xla_stablehlo_bf16"
  },
  "add_sub_cost": 1,
  "bitwise_cost": 1,
  "shift_cost": 1,
  "cmp_cost": 1,
  "mul_cost": 2,
  "div_mod_cost": 8,
  "fma_cost": 1,
  "select_cost": 1,
  "clz256_cost": 2,
  "add_sub_checked256_cost": 3,
  "mul_checked256_cost": 4,
  "min_gpu_elements": 65536,
  "gpu_block_threads": 256,
  "matmul_tile_dim": 16,
  "calibration_receipt": {
    "measured_ns": {
      "add_ns": 0.935,
      "mul_ns": 1.244,
      "div_ns": 5.2844,
      "fma_ns": 0.6226,
      "select_ns": 0.9321
    },
    "payload_digest_blake2b256": "905436d18b7139a0a3ddb62df6275622c88eb6473690f4e90cbcdcdb3732069c",
    "calibrated_at_utc": "2026-10-20T09:26:16Z"
  }
}
