{
  "schema_version": "lean-native-hardware-profile-v1",
  "profile_id": "cuda_nvidia_gb10_blackwell_sm121",
  "target": "cuda_ptx",
  "llvm_target_cpu": "neoverse-v2",
  "sm_arch": "sm_121",
  "hardware_metadata": {
    "host_os": "linux",
    "host_arch": "aarch64",
    "cpu_arch": "grace-blackwell-gb10",
    "cpu_model": "ARM Cortex-X925 / Cortex-A725 (Grace Blackwell GB10)",
    "gpu_model": "NVIDIA GB10 (Blackwell sm_121)",
    "l1d_bytes": 65536,
    "l2_bytes": 2097152,
    "slc_bytes": 33554432,
    "unified_memory": true
  },
  "cache_trm_tier": {
    "slice_id": "spark_gb10_nvfp4",
    "d_model": 64,
    "d_hidden": 128,
    "ngram_buckets": 16384,
    "table_d": 8,
    "default_h_cycles": 2,
    "default_l_cycles": 2,
    "max_footprint_bytes": 131072,
    "inference_path": "gpu_cuda_nvfp4_sm121",
    "batch_gpu_path": "cuda_ptx_nvfp4_tensor_core"
  },
  "add_sub_cost": 1,
  "bitwise_cost": 1,
  "shift_cost": 1,
  "cmp_cost": 1,
  "mul_cost": 5,
  "div_mod_cost": 36,
  "fma_cost": 2,
  "select_cost": 1,
  "clz256_cost": 2,
  "add_sub_checked256_cost": 3,
  "mul_checked256_cost": 5,
  "min_gpu_elements": 65536,
  "gpu_block_threads": 256,
  "matmul_tile_dim": 16,
  "calibration_receipt": {
    "measured_ns": {
      "add_ns": 1.0735,
      "mul_ns": 0.9838,
      "div_ns": 5.0282,
      "fma_ns": 0.5143,
      "select_ns": 1.0327
    },
    "payload_digest_blake2b256": "4d95b4da9613060a15ed1f948c0d4e1512aadbf2f9a9f2aed4f5efc85de54e37",
    "calibrated_at_utc": "2026-10-20T06:38:46Z"
  }
}
